{
    "id":  "feature-006",
    "title":  "Implement incremental feature slice 6",
    "category":  "feature",
    "repo_fixture":  "benchmarks/fixtures/minimal",
    "prompt":  "Benchmark workflow task for feature category #6.",
    "mode_cmds":  {
                      "codex_native":  [
                                           "codex",
                                           "--version"
                                       ],
                      "supercodex":  [
                                         "{NODE_PATH}",
                                         "{REPO_ROOT}/dist/cli.js",
                                         "status",
                                         "--json"
                                     ]
                  },
    "verify":  {
                   "type":  "command",
                   "target":  [
                                  "{NODE_PATH}",
                                  "-e",
                                  "process.exit(0)"
                              ]
               },
    "timeout_seconds":  30,
    "tags":  [
                 "starter",
                 "feature",
                 "generated"
             ],
    "risk_level":  "low"
}
