{
    "id":  "refactor-005",
    "title":  "Refactor maintainability path 5",
    "category":  "refactor",
    "repo_fixture":  "benchmarks/fixtures/minimal",
    "prompt":  "Benchmark workflow task for refactor category #5.",
    "mode_cmds":  {
                      "codex_native":  [
                                           "codex",
                                           "--version"
                                       ],
                      "supercodex":  [
                                         "{NODE_PATH}",
                                         "{REPO_ROOT}/dist/cli.js",
                                         "status",
                                         "--json"
                                     ]
                  },
    "verify":  {
                   "type":  "file_assert",
                   "target":  [
                                  "README.md",
                                  "src/app.ts"
                              ]
               },
    "timeout_seconds":  30,
    "tags":  [
                 "starter",
                 "refactor",
                 "generated"
             ],
    "risk_level":  "medium"
}
