{
  "id": "migration-001",
  "title": "Prepare migration for config key rename",
  "category": "migration",
  "repo_fixture": "benchmarks/fixtures/minimal",
  "prompt": "Design migration path from old config key to new key safely.",
  "mode_cmds": {
    "codex_native": ["codex", "--version"],
    "supercodex": ["{NODE_PATH}", "{REPO_ROOT}/dist/cli.js", "status", "--json"]
  },
  "verify": {
    "type": "file_assert",
    "target": ["README.md", "src/app.ts"]
  },
  "timeout_seconds": 30,
  "tags": ["starter", "migration"],
  "risk_level": "high"
}
