{
    "id":  "feature-003",
    "title":  "Implement incremental feature slice 3",
    "category":  "feature",
    "repo_fixture":  "benchmarks/fixtures/minimal",
    "prompt":  "Benchmark workflow task for feature category #3.",
    "mode_cmds":  {
                      "codex_native":  [
                                           "codex",
                                           "--version"
                                       ],
                      "supercodex":  [
                                         "{NODE_PATH}",
                                         "{REPO_ROOT}/dist/cli.js",
                                         "status",
                                         "--json"
                                     ]
                  },
    "verify":  {
                   "type":  "file_assert",
                   "target":  [
                                  "README.md",
                                  "src/app.ts"
                              ]
               },
    "timeout_seconds":  30,
    "tags":  [
                 "starter",
                 "feature",
                 "generated"
             ],
    "risk_level":  "low"
}
