{
    "id":  "review-007",
    "title":  "Run quality review pass 7",
    "category":  "review",
    "repo_fixture":  "benchmarks/fixtures/minimal",
    "prompt":  "Benchmark workflow task for review category #7.",
    "mode_cmds":  {
                      "codex_native":  [
                                           "codex",
                                           "--version"
                                       ],
                      "supercodex":  [
                                         "{NODE_PATH}",
                                         "{REPO_ROOT}/dist/cli.js",
                                         "status",
                                         "--json"
                                     ]
                  },
    "verify":  {
                   "type":  "file_assert",
                   "target":  [
                                  "README.md",
                                  "src/app.ts"
                              ]
               },
    "timeout_seconds":  30,
    "tags":  [
                 "starter",
                 "review",
                 "generated"
             ],
    "risk_level":  "low"
}
