{
  "id": "review-001",
  "title": "Review branch for regression risk",
  "category": "review",
  "repo_fixture": "benchmarks/fixtures/minimal",
  "prompt": "Review changes and identify regression and security risks.",
  "mode_cmds": {
    "codex_native": ["codex", "--version"],
    "supercodex": ["{NODE_PATH}", "{REPO_ROOT}/dist/cli.js", "status", "--json"]
  },
  "verify": {
    "type": "file_assert",
    "target": ["README.md", "src/app.ts"]
  },
  "timeout_seconds": 30,
  "tags": ["starter", "review"],
  "risk_level": "medium"
}
