{
  "id": "bugfix-001",
  "title": "Resolve null check bug in handler",
  "category": "bugfix",
  "repo_fixture": "benchmarks/fixtures/minimal",
  "prompt": "Identify and fix null/undefined handling edge case.",
  "mode_cmds": {
    "codex_native": ["codex", "--version"],
    "supercodex": ["{NODE_PATH}", "{REPO_ROOT}/dist/cli.js", "status", "--json"]
  },
  "verify": {
    "type": "file_assert",
    "target": ["README.md", "src/app.ts"]
  },
  "timeout_seconds": 30,
  "tags": ["starter", "bugfix"],
  "risk_level": "medium"
}
