{
  "id": "debug-002",
  "title": "Root-cause memory pressure regression",
  "category": "debug",
  "repo_fixture": "benchmarks/fixtures/minimal",
  "prompt": "Perform root-cause analysis for memory pressure regression.",
  "mode_cmds": {
    "codex_native": ["codex", "--version"],
    "supercodex": ["{NODE_PATH}", "{REPO_ROOT}/dist/cli.js", "status", "--json"]
  },
  "verify": {
    "type": "command",
    "target": ["{NODE_PATH}", "-e", "process.exit(0)"]
  },
  "timeout_seconds": 30,
  "tags": ["starter", "debug"],
  "risk_level": "high"
}
