{
  "id": "refactor-001",
  "title": "Refactor duplicated utility flow",
  "category": "refactor",
  "repo_fixture": "benchmarks/fixtures/minimal",
  "prompt": "Refactor duplicated logic while preserving behavior.",
  "mode_cmds": {
    "codex_native": ["codex", "--version"],
    "supercodex": ["{NODE_PATH}", "{REPO_ROOT}/dist/cli.js", "status", "--json"]
  },
  "verify": {
    "type": "file_assert",
    "target": ["README.md", "src/app.ts"]
  },
  "timeout_seconds": 30,
  "tags": ["starter", "refactor"],
  "risk_level": "medium"
}
